{
  "$comment": "Hand-authored BIM for the Customer Onboarding reference scenario, validated against bim.v0.2.schema.json. Business-language only. See ADR-011 for the BIM vs AIM contract and ADR-018 for why `userJourneys` lives here. This document is the source-of-truth for what business users want; it is intentionally partial and iterative, and the AI translation pipeline (BIM -> AIM -> CAM) resolves it into the deterministic canonical model.",
  "bimVersion": "0.2.0",
  "metadata": {
    "id": "bim.customer-onboarding",
    "name": "Customer Onboarding",
    "shortDescription": "Let a bank onboard a new customer end to end, from the customer starting an application to a manager approving it.",
    "industry": "Retail and small-business banking",
    "primaryOutcome": "A new customer exists in the bank's records, has been risk-assessed, and is ready to be issued products.",
    "businessOwner": "Head of Customer Operations",
    "authoredBy": "Dilip",
    "createdAt": "2026-07-23",
    "lastUpdatedAt": "2026-07-23",
    "language": "en",
    "status": "draft"
  },

  "changeHistory": [
    {
      "version": "0.1.0",
      "date": "2026-07-23",
      "author": "Dilip",
      "summary": "Initial hand-authored BIM for the first vertical slice.",
      "rationale": "Phase 0 reference artifact. Drives the shape of the BIM JSON Schema and the downstream AIM/CAM examples."
    },
    {
      "version": "0.2.0",
      "date": "2026-07-26",
      "author": "Dilip",
      "summary": "Added `userJourneys` for the Applicant and Reviewer paths.",
      "rationale": "ADR-018. The CAM requires an InteractionModel and no upstream artifact owned it, so the generator invented one from a role x entity cross-product. Journeys give the business user somewhere to say how people move through the capability, and give the AIM `interactionFlows` a stated source instead of a guess."
    }
  ],

  "capability": {
    "statement": "A prospective customer should be able to apply to become a customer of the bank. Bank staff should be able to check the application, ask for missing information, decide whether to accept it, and keep a full record of what happened and why.",
    "scope": {
      "included": [
        "Individual and business customers",
        "Customers in India and the United States (Phase 1 launch countries)",
        "Applications started by the customer themselves or by a branch officer on their behalf",
        "Basic risk assessment based on customer type, country and declared income",
        "Uploading identity and tax documents",
        "A single approval step by a manager for high-risk cases"
      ],
      "excluded": [
        "Product opening (accounts, cards, loans) — that is a separate capability",
        "Sanctions and PEP screening beyond a placeholder check",
        "Multi-branch approval routing"
      ]
    },
    "successMetrics": [
      "Most low-risk applications are approved on the same working day.",
      "No application can be approved without the required documents for its country and customer type.",
      "Any decision (approve, reject, request more info) can be explained after the fact — which rules fired, what was seen, who acted."
    ]
  },

  "personas": [
    {
      "name": "Applicant",
      "description": "The person applying to become a customer, or a business's authorised representative applying on behalf of the business.",
      "goals": [
        "Fill in the application without confusing jargon.",
        "Only be asked for information that is actually needed for their situation.",
        "Know what happens next and roughly when."
      ],
      "typicalActions": ["Start an application", "Save and come back later", "Upload documents", "Submit for review"]
    },
    {
      "name": "Reviewer",
      "description": "A bank operations analyst who checks applications for completeness and accuracy.",
      "goals": [
        "Quickly see what changed since last time.",
        "Ask the applicant for missing or better information without re-typing it.",
        "Route the case to a manager if it is above their approval limit."
      ],
      "typicalActions": ["Open a submitted application", "Request more information", "Send to manager for approval", "Reject with a reason"]
    },
    {
      "name": "Manager",
      "description": "A senior operations manager who approves higher-risk applications.",
      "goals": [
        "See the reviewer's notes and the risk assessment together.",
        "Approve or reject with an audit-quality reason."
      ],
      "typicalActions": ["Approve a high-risk case", "Reject with a reason", "Send it back to the reviewer"]
    },
    {
      "name": "Auditor",
      "description": "Read-only access for internal audit and compliance.",
      "goals": [
        "See everything about any application at any point in time.",
        "See who did what and why."
      ],
      "typicalActions": ["Open any historical application", "Export the audit trail"]
    }
  ],

  "businessObjects": [
    {
      "name": "Customer",
      "description": "The person or business the bank is being asked to onboard.",
      "attributes": [
        { "name": "Full name (individuals) or legal name (businesses)", "required": true },
        { "name": "Customer type", "required": true, "allowedValues": ["Individual", "Business"] },
        { "name": "Country of residence or registration", "required": true },
        { "name": "Date of birth (individuals) or date of incorporation (businesses)", "required": true },
        { "name": "Tax identifier", "note": "Format and which one is required depends on country and customer type." },
        { "name": "Declared annual income (individuals) or declared annual turnover (businesses)" },
        { "name": "Contact email", "required": true },
        { "name": "Contact phone" }
      ]
    },
    {
      "name": "Onboarding case",
      "description": "One attempt by an applicant to become a customer. Has a status, an owner, a history, and attached documents.",
      "attributes": [
        { "name": "Case reference", "required": true, "note": "Human-friendly identifier shown to the applicant and staff." },
        { "name": "Status", "required": true, "note": "Draft, submitted, in review, waiting for applicant, approved, rejected." },
        { "name": "Assigned reviewer" },
        { "name": "Risk score", "note": "Number from 0 to 10. Higher means more risk." },
        { "name": "Risk band", "note": "Low, Medium, High. Derived from the score." },
        { "name": "Decision reason", "note": "Free-text captured at approve or reject." }
      ]
    },
    {
      "name": "Document",
      "description": "A file the applicant uploads as part of their application.",
      "attributes": [
        { "name": "Document type", "required": true, "note": "e.g. Passport, PAN card, GST certificate, Utility bill." },
        { "name": "Uploaded file", "required": true },
        { "name": "Uploaded at", "required": true },
        { "name": "Verified by reviewer" }
      ]
    }
  ],

  "workflow": {
    "description": "A case moves through these stages. Most cases go through them in order but reviewers can send a case back for more information.",
    "stages": [
      { "name": "Draft", "description": "Applicant is still filling it in. Not visible to staff yet." },
      { "name": "Submitted", "description": "Applicant has submitted. A reviewer is assigned automatically." },
      { "name": "In review", "description": "A reviewer is actively working on it." },
      { "name": "Waiting for applicant", "description": "Reviewer has asked for more information. Applicant can update and resubmit." },
      { "name": "Pending manager approval", "description": "Reviewer has sent a high-risk case to a manager." },
      { "name": "Approved", "description": "Terminal. Customer record is created." },
      { "name": "Rejected", "description": "Terminal. Reason is recorded." }
    ],
    "notes": [
      "Applicants can save a draft and come back to it for up to 30 days before it is auto-discarded.",
      "Approved and rejected cases are read-only forever — no edits, only comments by staff with the right permission."
    ]
  },

  "userJourneys": [
    {
      "name": "Apply to become a customer",
      "persona": "Applicant",
      "description": "The applicant fills in who they are, uploads what we asked for, checks it over, and submits. All of this happens while the case is still in the Draft stage — the workflow stages are what the bank tracks, this is what the applicant experiences.",
      "steps": [
        {
          "name": "Tell us about you",
          "description": "Ask for the basics: who they are, how to reach them, and roughly what their financial position is. Group them so it does not feel like one long list.",
          "asks": [
            "Full name (individuals) or legal name (businesses)",
            "Customer type",
            "Country of residence or registration",
            "Date of birth (individuals) or date of incorporation (businesses)",
            "Tax identifier",
            "Contact email",
            "Contact phone",
            "Declared annual income (individuals) or declared annual turnover (businesses)"
          ]
        },
        {
          "name": "Upload your documents",
          "description": "Ask them to attach each document we need and say which one it is. Which documents are needed depends on their country and customer type.",
          "asks": ["Document file", "Document type"]
        },
        {
          "name": "Review and submit",
          "description": "Show back what they told us so they can catch mistakes before it goes to a reviewer. Nothing is editable here — if it is wrong they go back.",
          "asks": []
        }
      ]
    },
    {
      "name": "Work a case",
      "persona": "Reviewer",
      "alsoSeenBy": ["Manager", "Auditor"],